{
  "schema": "assemblygrid-recipe-v1",
  "id": "pair_assembly",
  "raw_tokens": [
    "A",
    "B"
  ],
  "operations": [
    {
      "id": "pair_join",
      "kind": "assemble",
      "inputs": [
        "A",
        "B"
      ],
      "output": "FINAL",
      "predecessors": [],
      "predecessor_any": [],
      "kappa": 2,
      "roles": [
        "holder_A",
        "holder_B"
      ],
      "role_inputs": {
        "holder_A": "A",
        "holder_B": "B"
      },
      "role_skills": {
        "holder_A": "assemble",
        "holder_B": "assemble"
      },
      "role_tools": {},
      "resources": [],
      "duration": 4,
      "productive_weight": 1.2
    }
  ],
  "final_token": "FINAL",
  "product_value": 1.0
}
