{
  "schema": "assemblygrid-recipe-v1",
  "id": "alternative_route",
  "raw_tokens": [
    "A",
    "B"
  ],
  "operations": [
    {
      "id": "join_precise",
      "kind": "align",
      "inputs": [
        "A",
        "B"
      ],
      "output": "AB",
      "predecessors": [],
      "predecessor_any": [],
      "kappa": 2,
      "roles": [
        "holder_A",
        "holder_B"
      ],
      "role_inputs": {
        "holder_A": "A",
        "holder_B": "B"
      },
      "role_skills": {},
      "role_tools": {},
      "resources": [],
      "duration": 5,
      "productive_weight": 1.0
    },
    {
      "id": "join_fast",
      "kind": "assemble",
      "inputs": [
        "A",
        "B"
      ],
      "output": "AB",
      "predecessors": [],
      "predecessor_any": [],
      "kappa": 3,
      "roles": [
        "holder_A",
        "holder_B",
        "operator"
      ],
      "role_inputs": {
        "holder_A": "A",
        "holder_B": "B"
      },
      "role_skills": {},
      "role_tools": {},
      "resources": [],
      "duration": 2,
      "productive_weight": 1.15
    },
    {
      "id": "finish",
      "kind": "inspect",
      "inputs": [
        "AB"
      ],
      "output": "FINAL",
      "predecessors": [],
      "predecessor_any": [
        [
          "join_precise",
          "join_fast"
        ]
      ],
      "kappa": 1,
      "roles": [
        "inspector"
      ],
      "role_inputs": {
        "inspector": "AB"
      },
      "role_skills": {},
      "role_tools": {},
      "resources": [],
      "duration": 2,
      "productive_weight": 1.0
    }
  ],
  "final_token": "FINAL",
  "product_value": 1.0
}
