{
  "schema": "assemblygrid-recipe-v1",
  "id": "standard_abc",
  "raw_tokens": [
    "A",
    "B",
    "C"
  ],
  "operations": [
    {
      "id": "align_ab",
      "kind": "align",
      "inputs": [
        "A",
        "B"
      ],
      "output": "AB",
      "predecessors": [],
      "predecessor_any": [],
      "kappa": 2,
      "roles": [
        "holder_A",
        "holder_B"
      ],
      "role_inputs": {
        "holder_A": "A",
        "holder_B": "B"
      },
      "role_skills": {
        "holder_A": "align",
        "holder_B": "align"
      },
      "role_tools": {},
      "resources": [],
      "duration": 3,
      "productive_weight": 1.0
    },
    {
      "id": "stabilize_insert",
      "kind": "assemble",
      "inputs": [
        "AB",
        "C"
      ],
      "output": "FINAL",
      "predecessors": [
        "align_ab"
      ],
      "predecessor_any": [],
      "kappa": 4,
      "roles": [
        "holder_AB",
        "holder_C",
        "operator",
        "stabilizer"
      ],
      "role_inputs": {
        "holder_AB": "AB",
        "holder_C": "C"
      },
      "role_skills": {
        "holder_AB": "assemble",
        "holder_C": "assemble",
        "operator": "assemble",
        "stabilizer": "assemble"
      },
      "role_tools": {},
      "resources": [],
      "duration": 5,
      "productive_weight": 1.5
    }
  ],
  "final_token": "FINAL",
  "product_value": 1.0
}
